The client's card reads simply "M. Calhoun." Like so many others, he comes across all dismayed to learn that Cool is a woman and Lam is a runt. Only after he pays a standard retainer and exits the office do Bertha and Donald unmask the man behind the "M.": filthy rich Milton Carling Calhoun II. And the receptionist swears he came in specifically asking for *Mrs.* Cool. The agency has been hired by him to locate a writer named Colburn Hale, who seems to have cleared out of his apartment overnight, leaving no trace. Calhoun claims he just wants to have a chat with Hale. Yet, when Donald reports that he's been able to track the writer's supposed girlfriend, Nanncie Beaver--a woman Calhoun never so much as mentioned--down to the Mexican border town of Calexico, the client hotfoots it down by car, overnight, in a pouring rainstorm. Then Frank Sellers, of LAPD's Homicide Division, unexpectedly joins the Calexico party. And that's when Donald's case really goes south.|	{"authors": ["/authors/OL23222A"], "covers": [9450671]}
/works/OL15097438W	Representative selections, with introd., bibliography, and notes, by Harry Hayden Clark	This volumes contains the major writings of Thomas Paine, as well as a biographical chronology of Paine's life. The comprehensive introductory chapter by editor Harry Hayden Clark is a valuable synthesis of Paine's principles and the origins of his thinking. Clark's introduction could stand on its own as a sympathetic evaluation of Paine's contributions to moral philosophy, political theory, and political economy.	{"authors": ["/authors/OL31439A"], "subjects": ["political economy", "agrarian justice", "privilege", "Physiocratie", "moral principles"]}
/works/OL15102252W	Born to Race (Speed Racer Junior Novel)	In this novelization, Speed Racer—a fearless young race car driver— is given an unprecedented offer to join Royalton Industries’ renowned racing team. But Speed refuses once he learns that Royalton and other racing moguls are fixing the races. But if Speed won’t drive for Royalton, Royalton swears that the Speed will never race again! The only way for Speed to save the sport he loves is to team up with his one-time rival—the mysterious Racer X—in the death-defying, cross-country rally.	{"authors": ["/authors/OL32266A"], "subjects": ["Automobile racing", "Juvenile fiction", "Fiction", "Children's fiction", "Automobile racing, fiction"], "covers": [2662952]}
/works/OL15106247W	Skin Hunger (A Resurrection of Magic)	Dans un monde où la magie est une rareté, la maîtriser a un prix ...	{"authors": ["/authors/OL20118A"], "subjects": ["Magic", "Juvenile fiction", "Schools in fiction", "Fiction", "Fantasy", "Magic in fiction", "Schools", "Children's fiction", "Magic, fiction", "Schools, fiction", "Fantasy fiction", "Magie", "Romans, nouvelles", "\u00c9coles", "Torture", "Relations enseignants-\u00e9l\u00e8ves"], "covers": [436249, 2548990, 13019965]}
/works/OL15107197W	Little Fern's first winter	Fern and her brother Bracken play hide and seek as the other animals prepare for the first snowstorm of winter.	{"authors": ["/authors/OL24663A"], "subjects": ["Rabbits", "Animals", "Brothers and sisters", "Animals in fiction", "Fiction", "Brothers and sisters in fiction", "Rabbits in fiction", "Snow", "Hide-and-seek in fiction", "Snow in fiction", "Hide-and-seek", "Juvenile fiction", "Siblings", "Children's fiction", "Brothers and sisters, fiction", "Siblings, fiction"], "covers": [2380032]}
/works/OL151071W	Tintin au Tibet	Tintin searches for his lost friend Tchang.	{"authors": ["/authors/OL595213A"], "subtitle": "Les aventures de Tintin", "subjects": ["series:tintin", "Fiction", "Comic books, strips", "Friendship in fiction", "Bandes dessin\u00e9es", "Friendship", "Cartoons and comics", "Caricatures and cartoons", "Pictorial French wit and humor", "Juvenile fiction", "Children's fiction", "Adventure and adventurers, fiction", "Adventure and adventurers", "Novela gr\u00e1fica", "Ficci\u00f3n juvenil", "Aventuras", "Mu\u00f1equitos, tiras c\u00f3micas", "Tintin (fictitious character), fiction", "Tibet autonomous region (china), fiction"], "first_publish_date": "December 1988", "covers": [491669, 6073442, 8728169, 8728175]}
/works/OL15108625W	On the court with-- Hakeem Olajuwon	Examines the life and career of the Houston Rockets' star center who ranks in the NBA top ten for blocked shots, points scored, and rebounding.	{"authors": ["/authors/OL7413274A"], "subjects": ["Houston Rockets (Basketball team)", "Juvenile literature", "Basketball players", "Biography", "Nigerian Americans"], "covers": [1175096]}
/works/OL15109030W	The complete guide to selling a business	"Complete guidance on deciding whether to sell, setting a price, getting the best deal and more. The new edition includes updated tax laws and regulations and information on bulk sale laws"--Provided by publisher.	{"authors": ["/authors/OL26043A"], "subjects": ["Law and legislation", "Popular works", "Sale of business enterprises", "Small business", "Small business, law and legislation", "Small business, united states"]}
/works/OL15109298W	A night in the cemetery and other stories of crime & suspense [42 stories]	The English-language debut of Anton Chekhov's first collection of mystery and suspense tales. Considered  one of the greatest dramatists of all time, Anton Chekhov actually began his literary career as a crime and mystery writer. Scattered throughout periodicals and literary journals from 1880-1890, Peter Sekirin brings together these psychological suspense stories in a premier collection that provides a fresh look into Chekhov's literary heritage and his formative years as a writer.	{"authors": ["/authors/OL19677A"], "subjects": ["Translations into English", "Russian Short stories", "Fiction, mystery & detective, collections & anthologies", "Fiction, mystery & detective, short stories", "Fiction, suspense", "Crime, fiction", "FICTION", "Mystery & Detective", "Collections & Anthologies"], "covers": [12768909]}
/works/OL15112692W	Tugumanca	Excellent lyric poetry by an eminent Kannada author.	{"authors": ["/authors/OL566205A"]}
/works/OL15112738W	Dpal mṅaʼ bdag sgra sgyur Mar-pa lo tsā ba Chos-kyi-blo-gros kyi gsuṅ ʼbum bźugs so	Collected works of Marpa Lotsaba on Kagyud doctrines, Tantric Buddhism and rituals etc.	{"authors": ["/authors/OL307392A"], "subjects": ["Early works to 1800", "Bka\u02bc-rgyud-pa (Sect)", "Doctrines", "Tantric Buddhism", "Rituals", "Bka\u02bc-brgyud-pa (Sect)", "Miscellanea", "Biography"]}
/works/OL15113708W	Gouverner la Nouvelle-Calédonie	La Nouvelle-Calédonie, caractérisée par son originalité et sa complexité institutionnelle, a été dotée en 1999 d'un nouveau statut. Ces textes dérogent à de nombreux principes fondateurs de la République, et le gouvernement est désormais constitué à la représentation proportionnelle. Système sans précédent, il place la barre très haut, exige beaucoup dans un pays qui a connu des affrontements sanglants par le passé. Ce livre brosse la vie politique de la Nouvelle-Calédonie, engagée dans une autonomie croissante, vers son autodétermination.	{"authors": ["/authors/OL6786327A"], "subtitle": "l'accord de Noum\u00e9a \u00e0 l'\u00e9preuve de son premier gouvernement : Jean L\u00e8ques : 1999-2001", "subjects": ["F.L.N.K.S.", "Politics and government"]}
/works/OL15119311W	Regeneration	|Joyce Lackey was a classic baby-boomer. She had it all: a high-paying position, a beautiful condo, a BMW. But there was one thing she didn't have any more -- her youth. And that was what she needed most. Her boss fired her because he wanted someone with "young blood", "young ideas". Someone young, Joyce was forced to start all over again. But could she compete with all the beautiful young kids who were so hungry for what she had?

That's where the X-Gen Agency came in. They could give Joyce everything she wanted, everything she needed -- a new job, a new body, a new identity. In short, a new life. But there was a price. A very high price. It seemed reasonable enough when Joyce signed the contracts, and besides, she was desperate. By the time she realized what she had done, it was too late to turn back. This was one contract without an escape clause.|	{"authors": ["/authors/OL6265375A", "/authors/OL20196A"], "subjects": ["Fiction", "Horror"], "covers": [640735]}
/works/OL15120514W	How to knit a love song	Abigail is more than ready for a change when she inherits a cottage from her beloved mentor, knitting guru Eliza Carpenter. Leaving the oppressive city for the greener pastures of a small California beach town, she intends to turn her cozy little windfall into a knitting shop and spend her days spinning, designing, and purling. But she's not going to be welcomed with open arms by her new neighbor. Eliza's disgruntled nephew, the gorgeous Cade, now owns everything surrounding Abigail's ramshackle new home, and he views this sexy city girl as an unwanted interloper.But chemistry working overtime is drawing two very different people closer than they ever thought possible. And when the past that Abigail thought she'd left behind comes calling, she'll have to somehow learn to trust her handsome adversary with much more than just her heart.	{"authors": ["/authors/OL6795043A", "/authors/OL6762892A"], "subtitle": "a Cypress Hollow yarn", "subjects": ["Fiction", "Knitters (Persons)", "Ranch life", "Literature", "Inheritance and succession", "Love stories", "City and town life", "Large type books", "Fiction, romance, general", "Frontier and pioneer life, fiction"], "covers": [6309441]}
/works/OL15121411W	Kepemimpinan sekolah transformatif	Study on the success of leadership of three principal in Yogyakarta.	{"authors": ["/authors/OL6787356A"]}
/works/OL15122144W	Heterogeneous harm vs. spatial spillovers	"The economics of environmental federalism identifies two book-end departures from the first-best, which equates marginal costs and benefits in all local jurisdictions.  Local governments may respond to local conditions, but ignore inter-jurisdictional spillovers.  Alternatively, central governments may internalize spillovers, but impose uniform regulations ignoring local hetero-geneity.  We provide a simple model that demonstrates that the choice of policy depends crucial-ly on the shape of marginal abatement costs.  If marginal costs are increasing and convex, then abatement cost elasticities will tend to be higher around the local policies.  This increases the deadweight loss of those policies relative to the centralized policy, ceteris paribus. Using a large simulation model, we then empirically explore the tradeoffs between local versus second-best uniform policies for US air pollution.  We find that US states acting in their own interest lose about 31.5 % of the potential first-best benefits, whereas the second-best uniform policy loses only 0.2 % of benefits.  The centralized policy outperforms the state policy for two reasons.  First, inter-state spillovers are simply more important that inter-state hetero-geneity in this application.  Second, welfare losses are especially small under the uniform policy because elasticities are much higher over the relevant range of the cost functions"--National Bureau of Economic Research web site.	{"authors": ["/authors/OL6787602A"], "subtitle": "environmental federalism and US air pollution"}
/works/OL15124356W	Elephant woman	A biography of Cynthia Moss, world-renowned elephant researcher in Kenya's Amboseli National Park, illustrated with her own photographs.	{"authors": ["/authors/OL26645A"], "subtitle": "Cynthia Moss explores the world of elephants", "subjects": ["African elephant", "Behavior", "Biography", "Elephants", "Juvenile literature", "Women", "Zoologists"], "covers": [6727555]}
/works/OL15126188W	A Bug's Life	Flik may be a little ant, but he sure has big problems! Can he save the day before the angry grasshoppers squish every last ant in the colony?	{"authors": ["/authors/OL23784A"], "subjects": ["Insects", "Juvenile fiction", "Grasshoppers", "Ants", "Fiction"], "covers": [6790184, 166209]}
/works/OL15128220W	Lauren's Afterschool Job	Lauren loves her new job at the antiques store, but nasty Ginger Kinkaid is working right next door, and Lauren doesn't want anything to do with her. But, then Ginger starts sharing secrets with Patti--is she out to make Patti her new best friend? Not if Lauren and the Sleepover Friends can help it!	{"authors": ["/authors/OL29834A"], "subjects": ["Juvenile fiction", "Friendship", "Fiction", "Children's fiction", "Girls, fiction"], "covers": [8229888]}
/works/OL15135346W	Care Bears who's who?	Identifies each Care Bear and describes the individual personality of each bear.	{"authors": ["/authors/OL1388797A"], "subtitle": "sticker storybook", "subjects": ["Care Bears (Fictitious characters)", "Bears", "Fiction", "Children's fiction", "Personality, fiction", "Care bears (fictitious characters), fiction"], "covers": [6469227]}
/works/OL15135542W	Cat Who Went to Paris / Cat Abroad	|Contains:

 - [The Cat Who Went to Paris](https://openlibrary.org/works/OL3374758W/Cat_Who_Went_to_Paris)
 - [A Cat Abroad](https://openlibrary.org/works/OL3374757W)|	{"authors": ["/authors/OL549900A"], "subjects": ["Anecdotes", "Biographies", "Biography", "cats", "American novelists", "nonfiction", "pets", "Cat owners", "Novelists", "American", "Scottish fold cat", "Fiction", "Americans", "Travel"], "covers": [9273505]}
/works/OL1513701W	The adventures of Uncle Wiggily	A collection of stories about the adventures of a wise rabbit and his animal and human friends.	{"authors": ["/authors/OL160777A"], "subjects": ["Rabbits", "Children's stories, American", "Fiction", "Animals", "Short stories", "Children's fiction", "Rabbits, fiction", "Animals, fiction"], "first_publish_date": "1924", "dewey_number": ["[Fic]", "jFIC"], "covers": [5926788, 1759955, 1814149, 1849093, 9035609]}
/works/OL15141286W	Grilling & barbecuing	Introduces seventy-five innovative, easy-to-prepare recipes for a variety of mouthwatering outdoor dishes from various regions of America, including Gulf Coast Prawns with Lemon and Sweet Pepper Relish, New York Strip Steak with Thyme and Garlic Paste, and Cow-Country Dutch Oven Short Ribs. 15,000 first printing.	{"authors": ["/authors/OL1434104A", "/authors/OL2833291A"], "subtitle": "food and fire in regional American cooking", "subjects": ["Barbecue cookery", "General cookery", "National & regional cuisine", "Cooking / Wine", "Cooking", "USA", "Methods - Barbecue & Grilling", "Methods - Outdoor", "Cooking / Barbecue", "Barbecue cooking", "Barbecuing", "grilling month"], "covers": [6507404, 848912]}
/works/OL15146055W	Math.	Includes the most important elements of the fifth grade math curriculum and the skills that support the goals and objectives of this grade. Skills include: estimating, percents, math operations, measurement, decimals, and fractions.	{"authors": ["/authors/OL6588098A"], "subjects": ["Mathematics", "Study and teaching (Elementary)", "Mathematics, juvenile literature"], "covers": [6537261]}
/works/OL15152208W	Sisters in crime 2	A collection of crime and mystery stories. Authors include Mary Higgins Clark, Sue Grafton, and Nancy Pickard.	{"authors": ["/authors/OL217134A"], "subjects": ["American Detective and mystery stories", "Women authors", "Short stories", "Mystery and detective stories", "Detective and mystery stories", "Short stories, american", "American fiction, women authors"], "covers": [6562927]}
/works/OL15157666W	Wayback	A mysterious Nazi super weapon, hidden for more than 60 years, has been discovered by members of a reclusive, private think tank and perfected using modern technology. This fully realized and reliable device is so powerful, so provocative, that the basic beliefs of science, history and religion could be overturned in an instant. After a cataclysmic system failure kills an expedition attempting to return to the year 100,000 BC, a team of skeptical scientists and adventurers is dispatched to the Antediluvian world, a world that no one anticipated full of wonder, danger and advanced civilizations that will rock the accepted theories of science and history to their core. However, the team is unaware of another plan that is unfolding; there are people who will kill to use this remarkable machine to further their own plans for our past and future. - Publisher.	{"authors": ["/authors/OL6807702A"]}
/works/OL15158437W	Charlie Brown's 'Cyclopedia Volume 12	Charlie Brown's 'cyclopedia (?'s etc #12) Super Questions etc. Featuring: Holidays	{"authors": ["/authors/OL2751472A"], "subtitle": "Super Questions and Answers and Amazing Facts: Featuring Holidays", "subjects": ["Featuring", "Holidays", "Science", "Questions and answers", "Encyclopedias"], "covers": [6472097]}
/works/OL15160358W	Flags unfurled	A reader on the fourth grade level, with a Christian orientation and designed to impart good moral values.	{"authors": ["/authors/OL1330889A", "/authors/OL216148A"], "subjects": ["Christian literature", "Children's literature", "Readers (Primary)", "Readers"], "covers": [6696494]}
/works/OL15163050W	None but a mule, by Barbara Woollcott.	This the memoir of growing up in a eccentric Baltimore family of 4 girls and their parents. The  paterfamilias is the brother of Algonquin wit Alexander Woollcott, who appears in the book occasionally. Also having a cameo is HL Mencken, a personal friend of the family. I stumbled upon this book by complete accident and was charmed. In doing a little research on the author and her sisters lives after the book it is clear that they all remained real characters.	{"authors": ["/authors/OL2180200A"], "covers": [7207688]}
/works/OL15164686W	Walt Disney Pictures' Return to Oz	|Dorothy Gale travels back to Oz with her pet hen and finds herself pitted against the evil Princess Mombi and the Gnome King.

This is a paperback comic book adaptation of the dark Disney film which follows the story closely and features accurate depictions of the actors who appeared in the movie. No authors or illustrators are credited.|	{"authors": ["/authors/OL714158A"], "subjects": ["Comic books", "comics", "Motion Pictures", "Movies", "Films", "Adaptation", "Fantasy", "Fiction", "Juvenile fiction", "Juvenile literature", "Imaginary Voyages", "Imaginary voyages in fiction", "Children's stories", "Adventure and adventurers", "Witches", "Russian", "American", "Witches in fiction", "Dorothy Gale (Fictitious character)", "Tin Woodman (Fictitious character)", "Cowardly Lion (Fictitious character)", "Scarecrow (Fictitious character : Baum)", "Disney", "Walt Disney", "Literature"], "covers": [6699611]}
/works/OL15165411W	Cult of Osiris	In Andy McDermott's brilliant new novel, Nina Wilde and Eddie Chase are on the hunt for the lost pyramid of Osiris... The incredible secret of the Great Sphinx of Egypt is about to be revealed. An archaeological dig is preparing to open the Hall of Records, a repository of ancient knowledge hidden beneath the enigmatic statue. But on the night of the unveiling student Macy Sharif makes a shocking discovery: a religious cult already raiding the Hall of Records to find the location of the mythical Pyramid of Osiris. Framed by corrupt officials, she goes on the run, trying to reach the only people who can save her before she is silenced permanently. Discredited, jobless and broke, archaeologist Nina Wilde and ex-SAS soldier Eddie Chase have problems of their own until Macy's plea for help sends them on a deadly quest across the globe as they try to reach the mysterious pyramid before Khalid Osir, the charismatic leader of the Osirian Temple. But is the cult's motive purely greed... or something more sinister?	{"authors": ["/authors/OL6808264A"], "subjects": ["Eddie Chase (Fictitious character)", "Excavations (Archaeology)", "Women archaeologists", "Nina Wilde (Fictitious character)", "Fiction", "Women archaeologists, fiction", "Egypt, fiction", "Fiction, suspense", "Fiction, thrillers, general", "Soldiers of fortune", "Italo-Ethiopian War, 1935-1936", "Illegal arms transfers", "Fiction, thrillers, suspense"], "covers": [6387966]}
/works/OL15167180W	19th Century Orleans Par LA Marriage Index v10 1807-1900	|Hunting For Bears Genealogy Society collects and maintains large databases of early (predominantly pre 1900) marriage records from all fifty states. We are currently processing these records and will have them on line as soon as they are ready.

We do two things with these records:
One, we publish these records in County Marriage Record Books, (over 2,000 to date) and on CDs. We no longer publish on microfiche but have a fairly complete inventory of our collection up to 1980.

Two, surname searches of these large computer databases have been available to individuals since the late 1960s via the U. S. Postal Service and now e-mail. We search our marriage indexes on a state by state basis and provide the results via e-mail or computer printout.

The Hunting For Bears marriage data collection as of about 1980, was the world's largest collection of U.S. marriage records in private hands. Eighteen states of data were availble for surname searches and were offered for sale on CDs in conjunction with Automated Archives(c).

Family Tree Maker(c) personal genealogy software bundled the H.F.B. marriage data with their product and sold tens of thousands of the various packages. The H.F.B. marriage data was crucial in making FTM(c) the most popular genealogical software in the world.

The same collection was included in Ancestry.com's(c) initial data searches, playing a significant role in its rise to the world's premier genealogy data search engine.

That was the 1980 collection, the 2010 collection dwarfs it in comparison. This book is part of that 2010 collection. It is maintained in a data base structure to provide the highest information density. Each marriage is contained in one line. Each party in the union is included in the alphabetical listing. Using the records in a database format and listing both participants in the alphabetical sort was so unique in 1960 that the U.S. Government has granted Hunting For Bears a (c)copyright on the collection in both print and later electronic and microform format.

Several things we are considering in the immediate future are; e_books to buy, loan or free downloads, books available through instant publication, and books on line.

Oh, the name and logo, Russell, as Nick was called in his youth, loved puns. The newspaper genealogy column that he began writing in 1951, Hunting Your Forebears, quickly became Hunting For Bears and the bear and hunter logo was created.

When available, record location information such as county book and page number may be included as well as age, birth or death dates, race, gender and information about prior marriages.|	{"authors": ["/authors/OL987399A", "/authors/OL7169059A"], "subjects": ["hfblano19", "hfb", "hfbla", "19th Century Orleans Parish Marriages 1807-1900", "vital", "vital record", "genealogy", "louisiana marriage record", "marriages", "louisiana ancestry", "louisiana archive", "louisiana vital records", "louisiana genealogies", "louisiana marriages", "cajun heritage", "la licences", "marriage licence", "marriage permit", "marr certificate", "joining", "union", "partner", "bride", "groom", "kin. kindred", "french", "spanish"], "covers": [6760364, 6760363]}
/works/OL15169813W	Ruby Roars	A noisy, exuberant story, ideal for young children and their parents to read aloud together, by two of Australia's favourite picture-book makers.When she was a baby, Ruby liked making popping noises with her dummy.'Pop! Pop! Pop!'When she was older, she tried making scary noises instead. 'Scrrr! Screekle! Scrunch!' But she couldn't frighten anyone, not a frog, not a fish. 'Shivers!' thought Ruby. What was the scariest noise she could make?And she opened her mouth wide to find out...An exuberant story from two of Australia's favourite picture-book makers, perfect for parents and children to read (and ROAR) aloud.	{"authors": ["/authors/OL31891A", "/authors/OL7981995A"], "subjects": ["Fiction", "Juvenile Fiction", "Noise", "Juvenile fiction", "Tasmanian devil", "Child and youth fiction"], "covers": [11382607]}
/works/OL15169852W	Frommer's® Istanbul	America's #1 bestselling travel series   Written by more than 175 outspoken travelers around the globe, Frommer's Complete Guides help travelers experience places the way locals do.      More annually updated guides than any other series    16-page color section and foldout map in all annual guides    Outspoken opinions, exact prices, and suggested itineraries    Dozens of detailed maps in an easy-to-read, two-color design     Frommer's Istanbul takes you beyond the tourist circuit to discover the city's hidden pleasures and historical secrets. Experience Istanbul like a local, thanks to our author's tips on buying authentic rugs and Turkish crafts, visiting a hamam, haggling in the markets, dining on street food, and avoiding time-honored scams.   Frommer's Istanbul includes suggested itineraries for seeing the city on a tight time-budget; walking tours through the city's grandest plazas and ancient back streets; side trips to get you out of the city and exploring a different perspective on Turkish life; an in-depth history and culture appendix that discusses the history, arts, language, and religions of Istanbul; and a beginner's Turkish glossary, to help you greet your Turkish counterparts in their own language.	{"authors": ["/authors/OL6812057A"], "subjects": ["Nonfiction", "Travel"], "covers": [6427492]}
