/works/OL13609028W	Fairy Tale	A captivating and witty dark fantasy that will have girls lusting after it.Morgan Sparks has always known that she and her boyfriend, Cam, are made for each other. But when Cam's cousin Pip comes to stay with the family, Cam seems depressed. Finally Cam confesses to Morgan what's going on: Cam is a fairy. The night he was born, fairies came down and switched him with a healthy human boy. Nobody expected Cam to live, and nobody expected his biological brother, heir to the fairy throne, to die. But both things happened, and now the fairies want Cam back to take his rightful place as Fairy King.Even as Cam physically changes, becoming more miserable each day, he and Morgan pledge to fool the fairies and stay together forever. But by the time Cam has to decide once and for all what to do, Morgan's no longer sure what's best for everyone, or whether her and Cam's love can weather an uncertain future.From the Hardcover edition.	{"authors": ["/authors/OL6467833A"], "subjects": ["Fiction", "Schools", "Fairies", "Changelings", "High schools", "Juvenile Fiction", "Forbyttede b\u00f8rn", "Feer", "Skiftinger", "Unge", "Dark fantasy", "JUVENILE NONFICTION", "Love & Romance", "General"], "first_publish_date": "2009", "dewey_number": ["[Fic]"], "covers": [6306022]}
/works/OL13614810W	Mranʻ mā Nuiṅʻ ṅaṃ nokʻ kroṅʻʺ pranʻ ʼa myuiʺ sāʺ cā cu cā raṅʻʺ (1974)	On backward compilation and national bibliography of books published in Burma in 1974.	{"authors": ["/authors/OL6473022A"], "first_publish_date": "1995"}
/works/OL13615365W	Karadeniz'de üç liman	Historical novel.	{"authors": ["/authors/OL6473537A"], "subjects": ["History"], "first_publish_date": "2007"}
/works/OL13623675W	Nepālamā ātma-nirṇayako adhikāra, samāveśī prajātantra, saṃvidhānasabhā ra saṅghiyatāko praśna	Rights of self-determination, inclusive democracy, federalism, and constituent assembly in Nepal.	{"authors": ["/authors/OL6481136A"], "subjects": ["Federal government", "National Self determination", "Self determination, National", "Democracy"], "first_publish_date": "2007"}
/works/OL13636133W	Moon boots and dinner suits	Jon Pertwee's acting career began with a public performance at the age of four. He seems to have been expelled from most of the schools his actor-writer father Roland Pertwee sent him to and finally joined RADA in 1936. From there too, he was asked to leave. Jon went into Rep and had a checkered career. In Brighton panic set in when he dressed as an old gardener in "Love from a Stranger" instead of as a young cleric in "Candida". In 1938 came Jon's first radio role in the BBC's "Lillibulero", in which year he also appeared in his father's play, "To Kill a Cat", directed by Henry Kendall at the Aldwych Theatre. When war came he joined the Navy, ramming Douglas Pier with an Isle of Man Steam Packet boat. He was blown up twice, once being put on a marble slab presumed dead, and spent many months stationed in the Scapa Flow. He was the founder of the Service Players in the Isle of Man. He was commissioned in the RNVR and transferred to Naval Intelligence where he worked and became good friends with the future Prime Minister James Callaghan. Then Jon joined Naval Broadcasting. His radio series, "The Navy Lark", ran for eighteen years and produced some truly vintage memories of radio. Whether telling stories of misspent youth, of his posterior's first painful introduction to a fives bat or his exploits with the McKenzie sisters in the north of Scotland, Jon Pertwee's humour and natural wit never fail him. "Moon Boots and Dinner Suits" is a wry, funny and endearing portrait of the early years of a most innovative and well loved actor. ~from inside jacket flap	{"authors": ["/authors/OL6492586A"], "subjects": ["Actors", "Biography"], "first_publish_date": "1984", "dewey_number": ["792/.028/0924"]}
/works/OL13644266W	What drives the current account in commodity exporting countries?	This paper uses an open economy DSGE model with a commodity sector and nominal and real rigidities to ask what factors account for current account developments in two small commodity exporting countries. We estimate the model, using Bayesian techniques, on Chilean and on New Zealand data, and investigate the structural factors that explain the behaviour of the two countries' current accounts. We find that foreign financial conditions, investment-specific shocks, and foreign demand account for the bulk of the variation of the current accounts of the two countries. In the case of New Zealand fluctuations in commodity export prices have also been important. Monetary and fiscal policy shocks (deviations from policy rules) are estimated to have relatively small e ects on the current account.We find interesting differences in Chilean and New Zealand responses to some shocks, despite similarities between the two economies and the common structural model employed.	{"authors": ["/authors/OL6500456A"], "first_publish_date": "2008"}
/works/OL13645161W	Vanish	Three strangers each encounter the same mysterious storm and awake the next day to find that everyone else has vanished. Afraid and desperate for answers, they eventually cross paths and discover they are being watched. A mysterious little boy appears to hold clues to the mystery, but when he disappears and the "observers" become agressive, the three are forced to flee Chicago in search of answers...and more survivors.	{"authors": ["/authors/OL6501304A"], "subjects": ["Fiction", "Homeless children", "Lawyers", "Mechanics (Persons)", "Mute persons", "Storms", "Models (Persons)", "Fiction, horror", "Lawyers, fiction", "Chicago (ill.), fiction", "Washington (d.c.), fiction", "Fiction, thrillers, general", "Law stories", "Large type books"], "first_publish_date": "2008", "dewey_number": ["813/.6"], "covers": [7986398]}
/works/OL13647873W	Sách tử chung lược ỷ	On the Catholic tenets in Vietnam.	{"authors": ["/authors/OL6503880A"], "first_publish_date": "1958"}
/works/OL13648541W	South Asia Regional Workshop on Security and Liberty	Programme and concept papers of the Workshop.	{"authors": ["/authors/OL6504533A"], "subjects": ["Congresses", "Human rights", "Terrorism", "Prevention"], "first_publish_date": "2007"}
/works/OL13653006W	Un grand écran pour les lettres	Quelle est la place actuelle du cinéma dans l'enseignement du français dans le secondaire ? Quelles pratiques pédagogiques ? Quelles représentations en ont les enseignants, quelle approche est proposée par les manuels scolaires ? L'ouvrage s'enrichit de réflexions sur les rapports entre littérature et cinéma et décrit des démarches novatrices menées dans des classes de collèges et lycées.	{"authors": ["/authors/OL6508929A"], "subjects": ["Study and teaching (Secondary)", "French language", "Motion pictures in education"], "first_publish_date": "2008"}
/works/OL13654497W	Dīvān al-Imām al-Shāfiʻī	Criticism and interpertation of the poems of Muḥammad ibn Idrīs Shafiʻī, 767 or 8-820.	{"authors": ["/authors/OL6510420A"], "first_publish_date": "2005"}
/works/OL13655949W	Kebajikan dan kebijakan Emha Sheh Harto, presiden seribu satu masjid	On charity and act of devotion of Soeharto, president Republic of Indonesia.	{"authors": ["/authors/OL6511850A"], "first_publish_date": "2008"}
/works/OL13657586W	Dumūʻ al-ḥuzn	Shiite elegiac poetry ; laṭmīyāt.	{"authors": ["/authors/OL6513440A"], "first_publish_date": "2002"}
/works/OL13668649W	Economics for humans	At its core, an economy is about providing goods and services for human well-being. But many economists and critics preach that an economy is something far different: a cold and heartless system that operates outside of human control. In this impassioned and perceptive work, Julie A. Nelson asks a compelling question: If our economic world is something that we as humans create, aren't ethics and human relationships—dimensions of a full and rich life—intrinsically part of the picture? Is it possible to take this thing we call economics and give it a body and a soul?Economics for Humans argues against the well-ingrained notion that economics is immune to moral values and distant from human relationships. Here, Nelson locates the impediment to envisioning a more considerate economic world in an assumption that is shared by both neoliberals and the political left. Despite their seemingly insurmountable differences, Nelson notes that they both make use of the metaphor, first proposed by Adam Smith, that the economy is a machine. This pervasive idea, Nelson argues, has blinded us to the qualities that make us work and care for one another—qualities that also make businesses thrive and markets grow. We can wed our interest in money with our justifiable concerns about ethics and social well-being. And we can do so if we recognize that an economy is not a machine, but a living, beating heart that circulates blood to all parts of the body while also serving as an emblem of compassion and care.Nothing less than a manifesto, Economics for Humans will both invigorate and inspire readers to reshape the way they view the economy, its possibilities, and their place within it.	{"authors": ["/authors/OL6524153A"], "subjects": ["Business", "Nonfiction", "Economics, moral and ethical aspects", "Feminist economics"], "first_publish_date": "2006", "covers": [6393426]}
/works/OL13683322W	Nitisāt nǣo sattrīniyom	Women's rights, gender equality, and laws for the protection of women.	{"authors": ["/authors/OL6538081A"], "subjects": ["Women's rights", "Women", "Legal status, laws"], "first_publish_date": "2006"}
/works/OL13696309W	Molecular changes in egg tempera paint dosimeters as tools to monitor the museum environment	Reports research on the principle of paint-based dosimetry of museum conditions. The idea was tested to use the physico-chemical response of egg tempera paint to its environment as an indicator of the environmental stress.	{"authors": ["/authors/OL6550317A"], "subjects": ["Painting", "Conservation and restoration", "Spectrum analysis", "Analysis", "Research", "Paint", "Deterioration", "Museum conservation methods"], "first_publish_date": "2001"}
/works/OL13725219W	Workshop Penanganan Pengungsi Internal di Indonesia	Internal refugees handling in Indonesia.	{"authors": ["/authors/OL6571173A"], "first_publish_date": "2002"}
/works/OL13726474W	Vatsā	Story about two sisters who radically change their lifestyles after marriage.	{"authors": ["/authors/OL6571978A"], "first_publish_date": "2002", "dewey_number": ["891.473"]}
/works/OL13731010W	[To miso pithari]	" The renowned educationalist Photeine Phrankule masterfully tells the superbly illustrated story of Eleni and her beloved grandfather, who brings the people, nature and the past of her native Lesbos close to her. He teaches her to preserve memories like dispersed and broken pieces of antique pottery. After his death, Eleni keeps coming back to these sights of her childhood as a grown-up woman to be true to his legacy. For everything tells of the ancestors' labour and sweat but also of the miseries of the refugees from both countries: Here is Lesbos, there is Asia-Minor, the former Greek home, and in between, the silver, starry strip of the Aegean Sea. Surely, the other half of the collected pottery must lie on the opposite, Turkish coast." ( Description from publisher)	{"authors": ["/authors/OL6575371A"], "subjects": ["Children's stories, Greek (Modern)", "Juvenile fiction", "Greece"], "first_publish_date": "2000", "covers": [10647830]}
/works/OL137312W	Ask For Me Tomorrow	|Gilda Decker needs a new bag, what with her second husband being suddenly crippled and her ex-husband hiding himself and his money somewhere in the hinterlands of Mexico. Gilda's recently retained lawyer, Tom Aragon, Mexican himself, is the best man for the job. But the deeper Aragon digs into her ex-husband's past the more dangerous his job becomes.

One of Millar’s few reoccurring characters and her only foray into the tradition of Chandler and Hammett, Tom Aragon, ranks among her best creations. A sarcastic but talented young lawyer with a few rough edges, Aragon finds himself navigating one entitled nest of vipers after another, not to mention racial prejudice.|	{"authors": ["/authors/OL22027A"], "subjects": ["Lawyers, fiction", "Mexico, fiction", "Aragon, tom (fictitious character), fiction", "Fiction, mystery & detective, general", "Mexican americans, fiction", "Mexican Americans", "Fiction", "Large type books", "Popular Print Disabled Books"], "first_publish_date": "1977", "covers": [8132095, 8132093, 785628]}
/works/OL13731391W	Romans 4 and the new perspective on Paul	In addition to examining Romans IV, includes discussion of writings supporting and opposing the New Perspective position.	{"authors": ["/authors/OL6575661A"], "subjects": ["Bible", "Criticism, interpretation", "Bible, criticism, interpretation, etc., n. t. epistles"], "first_publish_date": "2009", "dewey_number": ["227/.106"]}
/works/OL13740257W	Xiao lang hui hui	Because his father was put in jail, the little wolf Huihui and his mother are discriminated against their neighbors, until one day when Huihui tries to save little chick from drowning.	{"authors": ["/authors/OL6582589A"], "subjects": ["Fiction", "Neighbors", "Discrimination", "Friendship", "Animals"], "first_publish_date": "2004"}
/works/OL13741585W	The Kindaichi case files	Hajime Kindaichi is looking forward to a relaxing vacation at a luxurious lakefront resort, but when one of the other guests is murdered, Hajime must use his sleuthing skills to find the killer before he strikes again.	{"authors": ["/authors/OL3119303A", "/authors/OL6583738A", "/authors/OL3119302A"], "subjects": ["Murder", "Reality television programs", "Interns", "Mystery games", "Revenge", "Brigands and robbers", "Fiction", "Resorts", "Treasure troves", "Actors", "Fugitives from justice", "Inheritance and succession", "Vacations", "Mysteries, Espionage, & Detective Stories", "Comics & Graphic Novels - General", "Juvenile Fiction", "Children's Books/Young Adult Manga", "Children: Young Adult (Gr. 7-9)", "Comics & Graphic Novels - Manga", "Comics & Graphic Novels / Graphic Novels / Manga", "Detective and mystery comic books, strips", "Graphic novels", "Teenagers", "Comic books, strips"], "first_publish_date": "2003", "dewey_number": ["741.5/952"], "covers": [865491]}
/works/OL13743296W	Ich hab ein Zimmer frei	Anna longs to have the expensive red boots she saw in a mail order catalog that she cannot afford. She can rent a room of her large house.  All her tenants  (a goose, a carnival princess, a giraffe, etc.) are poor and she ends up spending more money on them than she earns.  Finally her tenants offer her a pair of red boots as a present.  She finds out that they are a bit small for her now.  This can only mean that Anna is growing up.	{"authors": ["/authors/OL6585247A"], "subjects": ["Children's stories, German", "Boots", "Fiction"], "first_publish_date": "2004"}
/works/OL13743684W	Viajero antes que turista	Artículos sobre los viajes realizados por el autor a través del departamento de La Libertad.	{"authors": ["/authors/OL6585608A"], "subjects": ["Travel", "Description and travel", "Descripciones y viajes", "Viaje"], "first_publish_date": "2004", "dewey_number": ["985/.16"]}
/works/OL13745175W	The big twitch	One man's quest to realise a boyhood dream and break a national record.Sean Dooley seems like a well adjusted, functioning member of society but beneath the respectable veneer he harbours a dark secret. He is a hard-core birdwatcher (aka twitcher').Sean takes a year off to try to break the Australian twitching record - he has to see more than 700 birds in twelve months. Travelling the length and breadth of Australia, he stops at nothing in search of this birdwatching Holy Grail, blowing his inheritance, his career prospects and any chance he has of finding a girlfriend.Part confessional, part travelogue, this is a true story about obsession. It's about seeking the meaning of life, trying to work out what normal' is, and searching for the elusive Grey Falcon (the bird, not the car). Sean's story of how he followed his childhood dream of becoming a national champion is both inspiring and ridiculous. Could this be the most pathetic great achievement in Australian history?	{"authors": ["/authors/OL6586877A"], "subjects": ["Bird watching", "Bird watchers", "Biography", "Biography & Autobiography", "Nonfiction", "Autobiography and memoir", "Nature and wildlife", "Australia, description and travel"], "first_publish_date": "2005", "dewey_number": ["598.0723494"], "covers": [13002922]}
/works/OL13752122W	Chilling Ghost Stories	|A collection of classic ghost stories:
Rats / M.R. James --
The raven / Edgar Allan Poe --
The birthday of the Infanta / Oscar Wilde --
A tough tussle / Ambrose Bierce --
Berenice / Edgar Allan Poe --
No. 1 branch line : the signalman / Charles Dickens.|	{"authors": ["/authors/OL20646A", "/authors/OL56244A", "/authors/OL24638A", "/authors/OL28127A", "/authors/OL21093A"], "dewey_number": ["813"]}
/works/OL13754729W	A matter of attitude	America's Next Top DesignerFashionista with the fiercest style sense and head-turning clothes? That's Angela Jenkins. Even though her cutting-edge designs and graphic legwear sometimes draw criticism from her peers, Angela knows that one day she will be a top designer, and her best friend at Kressler High, Adrian Gomez, is her biggest supporter. But at fifteen, how is anyone (like the extremely cute JaRoli Spencer) supposed to check her out when she's stuck working at her family's Caribbean-style restaurant all the time? The answer: getting elected director of her school's holiday fashion show. But Angela's got designer-clad competition: the very popular Karen Frasier, who has it all--including JaRoli. So when Shayla Mercer, the girl with the toughest street rep, offers to make sure Angela wins--for a fee--Angela says yes. And she learns that the price of popularity can be too high.	{"authors": ["/authors/OL6595691A"], "subjects": ["Fiction", "Fashion design", "Management", "Ambition", "African American teenage girls", "Fashion shows", "High school students", "African-American", "Romance", "Children's fiction", "African americans, fiction"], "first_publish_date": "2008", "dewey_number": ["813.6"], "covers": [6399644]}
/works/OL13761094W	POEMS AND ETUDES	A Collection of Poems including Three Ballads - Johnnie A-Lone; Tobacco Time; Psychedelic Trip. The Ballads set in Kentucky, Johnnie A-lone and Tobacco Time were set to music with Ms Patty Calaghan (Guitar and Harmonica).Some of the work is presented in the style of LINES, which the writer often uses: FINDING A BUTTERCUP;  ON THE MORNING OF THE NEWS OF THE DEATH OF ROBERT KENNEDY;  MOUNT BATTIE, MAINE;   ZINJIBAR.  Some poems were written while traveling; Gypsies,  and Red Poppy and Greek Sea (in Greece);  Plaza Del Torro (Mexico);  Sarnath in India;   America on Rye in California.  Two Children's Poems -- Bigtown Railroad and A Poem For Children - The Ducks Fly South.	{"authors": ["/authors/OL6556718A"], "first_publish_date": "1968", "dewey_number": ["818/.5/409"], "covers": [5543219]}
/works/OL13767991W	Zao an! Yidali	Malaysian essays (Chinese).	{"authors": ["/authors/OL6609654A"], "first_publish_date": "2008"}
/works/OL13776305W	Lao Lānna	Culture, customs, and the production of local whiskey in Lanna, Northern Thailand.	{"authors": ["/authors/OL6617562A"], "subtitle": "k\u0101nt\u014d\u031cs\u016b kh\u014d\u031cng khr\u01b0\u0304akh\u0101i Lao ph\u01b0\u0304nb\u0101n h\u01e3ng Prath\u0113t Thai", "subjects": ["Whiskey", "Northern Thai (Southeast Asian people)", "Social life and customs"], "first_publish_date": "2005"}
/works/OL13819234W	al-Kawākib al-durrīyah ʻalá al-Ḥadāʼiq al-wardīyah fī ajillāʼ al-sādah al-Naqshabandīyah taʼlīf al-Shaykh ʻAbd al-Majīd ibn Muḥammad ibn Muḥammad al-Khānī al-Shāfiʻī ..	Naqshabandīyah members; biography; annotated new edition.	{"authors": ["/authors/OL6690413A"], "first_publish_date": "1997"}
/works/OL13823478W	Lajnat al-Mutābaʻah li-Daʻm Qaḍīyat al-Muʻtaqalīn al-Lubnānīyīn fī Sujūn al-ʻAdūw al-Ṣihyūnī	Papers presented at the Conference of Follow-up Committee for Supporting Lebanese Prisoners on Israeli Camps, 1994.	{"authors": ["/authors/OL6694395A"], "subjects": ["Lebanese", "Prisoners", "Congresses", "Crimes against"], "first_publish_date": "1994"}
/works/OL13827475W	Ashyāʼ taḥta al-dhākirah	Modern Arabic short stories.	{"authors": ["/authors/OL6698115A"], "first_publish_date": "1999"}
/works/OL13833647W	Raqṣat al-mawt	Short stories.	{"authors": ["/authors/OL6703490A"], "first_publish_date": "2004"}
/works/OL13834523W	Safarjal	Poems.	{"authors": ["/authors/OL6704352A"], "first_publish_date": "2005"}
/works/OL13834608W	al-Naẓarīyah al-tarbawīyah fī al-Islām	Islamic education, theory.	{"authors": ["/authors/OL6704432A"], "first_publish_date": "2003"}
/works/OL13844634W	Aliran-aliran dalam Islam	Islamic sects in Indonesia.	{"authors": ["/authors/OL6714339A"], "subjects": ["Islamic sects"], "first_publish_date": "2009"}
/works/OL13847063W	Aspirasi pendidikan masyarakat Banjar	History and development of Islamic schools in Banjar, Kalimantan Selatan Province, Indonesia.	{"authors": ["/authors/OL6716717A"], "first_publish_date": "2007"}
/works/OL1397491W	The genius of Alexander the Great	By the time of his death in 323 BC, Alexander III of Macedonia had built an empire that stretched from the eastern Mediterranean coast through Asia minor and into the Indus Valley. A former student of the philosopher Aristotle, Alexander succeeded Philip the second as king of Macedonia in 336 BC and spent the next 13 years subduing and consolidating the lands of the Persian Empire. Even before his sudden death at the age of 32, Alexander had achieved mythical status throughout his kingdom, and in the centuries that followed, his life became the subject of countless chronicles and biographies. N.G.L. Hammond, the foremost expert on ancient Macedonian history, here presents a new account of Alexander's fabled career. Through a careful analysis of ancient sources -- the writings of Diodorus, Justin, Curtius, Plutarch, and Arrian -- Hammond has effectively separated the work of reliable contemporaries from fictional reports of Alexander's accomplishments. The resulting narrative, enriched by a lifetime of research, pronounces the Macedonian conqueror a man truly deserving of the title Alexander the Great. - Jacket flap.	{"authors": ["/authors/OL143719A"], "subjects": ["Kings and rulers", "Generals", "Psychology", "Influence", "Influence (Literary, artistic, etc.)", "Macedonian Expansion (Greece : 359-323 B.C.) fast (OCoLC)fst01353599", "Biography", "History", "Alexander, the great, 356 b.c.-323 b.c."], "first_publish_date": "1997", "covers": [590860]}
/works/OL1401613W	The Letters of Menakhem-Mendl, Sheyne-Sheyndl and Motl. the Cantor's Son	|"This volume presents a new translation of two favorite comic novels by the preeminent Yiddish writer Sholem Aleichem (1859-1916). The Letters of Menakhem-Mendl and Sheyne-Sheyndl portrays a tumultuous marriage through letters exchanged between the title character, an itinerant bumbler seeking his fortune in the cities of Russia before departing alone for the New World, and his scolding wife, who becomes increasingly fearful, jealous, and mystified.

Motl, the Cantor's Son is the first-person narrative of a mischievous and keenly observant boy who emigrates with his family from Russia to America. The final third of the story takes place in New York, making this Sholem Aleichem's only major work to be set in the United States.".

"Sholem Aleichem endows each character with an individual comic voice to tell in his own way the story of the collapse of traditional Jewish life in modern industrial society as well as the journey to America, where a new chapter of Jewish history begins. This volume includes a biographical and critical introduction as well as a useful glossary for English-language readers."--BOOK JACKET.|	{"authors": ["/authors/OL144345A"], "subjects": ["Sholem aleichem, 1859-1916", "Translations into English"], "first_publish_date": "June 1, 2002", "covers": [2355163]}
/works/OL1410429W	Ainsi parla l'oncle	|Ainsi parla l’Oncle, paru pour la première fois en 1928, est le premier manifeste de la condition noire. Cet ouvrage a influencé l’œuvre et la pensée des auteurs du mouvement de la négritude comme Léopold Sédar Senghor, Aimé Césaire et Léon-Gontran Damas.
Son ouvrage majeur Ainsi parla l'oncle (1928), écrit en français, étudie les fondements à la fois historiques et folkloriques de la culture haïtienne. Price-Mars y affirme que les Haïtiens ne sont pas des «Français colorés», mais des hommes nés en des conditions historiques déterminées et ayant un double héritage, français et africain. Ainsi parla l'oncle est la première tentative de réaliser une étude systématique de la culture des masses haïtiennes en la plaçant dans le cadre de la communauté nationale. Écrit pendant l'occupation américaine d'Haïti (1915-1934), ce livre pionnier vise clairement le but de soutenir le moral des Haïtiens en développant un nationalisme culturel.
Réédité dans un nouveau format, avec une iconographie nouvelle (paysages et figures de l’Afrique et d’Haïti), cet ouvrage propose une relecture de cette œuvre monumentale qui a servi de bréviaire aux intellectuels des peuples noirs. Pour penser le monde, pour comprendre les mécanismes de l’aliénation, soit du « bovarysme culturel », Jean Price-Mars a mis en avant les traditions, les légendes populaires, le vaudou et tout l’héritage africain qui fondent les cultures noires.
